{
  "meta": {
    "commodity": "sunflower",
    "display_name": "葵花油 (sunflower oil)",
    "report_date": "2026-07-21",
    "observation_end_date": "2026-07-20",
    "forecast_start_date": null,
    "forecast_end_date": null,
    "official_data_date": null,
    "build_time": "2026-07-21T02:35:09+00:00",
    "data_version": "commodity-monitoring-v1"
  },
  "countries": [
    "Canada",
    "Romania",
    "Russia",
    "Türkiye",
    "United States"
  ],
  "default_country": "Russia",
  "country_data": {
    "Canada": {
      "country_record": {
        "country": "Canada",
        "country_cn": "加拿大",
        "country_iso3": "CAN",
        "crop_group": "sunflower",
        "oil_group": "sunflower_oil",
        "crop_oil_label_cn": "葵籽/葵油",
        "production_basis_cn": "葵花籽产量",
        "production_basis_note_cn": "以葵花籽产量作为葵油天气暴露 proxy，并非成品葵油产量。",
        "total_production_tonnes": 80063.0,
        "source_name": "statcan",
        "source_year": 2025,
        "source_year_range": "2019-2025",
        "source_valid_for_frontend": true,
        "region_count": 4,
        "total_regions_with_weather": 4,
        "disturbed_production_tonnes": 13513.0,
        "disturbed_share": 0.1688,
        "weighted_risk_level": "mild",
        "weighted_risk_level_cn": "轻度异常",
        "weighted_risk_score": 0.506,
        "dominant_risk_type": "wetness_waterlogging",
        "dominant_risk_reason_cn": "土壤或降雨信号偏湿，需关注过湿和田间作业风险",
        "current_growth_stage_cn": null,
        "weather_condition_summary_cn": "",
        "soil_condition_summary_cn": "土壤状态正常，rootzone P66.7，surface P33.3",
        "production_impact_cn": null,
        "forecast_summary_cn": "未来7天累计降雨29.9mm，未来16天累计降雨45.1mm",
        "has_boundary": true,
        "boundary_level": "country",
        "boundary_file": "countries.geo.json",
        "aggregation_confidence": "medium",
        "aggregation_note_cn": "按地区产量权重聚合。",
        "updated_at": "2026-07-21 09:31:36",
        "dominant_country_badge_cn": "",
        "yield_risk_affected_share": 0.0,
        "operation_affected_share": 0.0,
        "progress_used_region_count": 0,
        "progress_used_share": 0.0,
        "progress_stage_source_summary": {
          "crop_progress": 0,
          "crop_calendar": 4,
          "mixed_calendar_progress": 0
        },
        "top_yield_risk_regions": [],
        "top_operation_risk_regions": [],
        "supportive_regions": [],
        "confidence_summary": "low",
        "soil_temp_used_region_count": 0,
        "soil_temp_used_share": 0.0,
        "soil_temp_stage_summary": {}
      },
      "summary": {
        "new_risks": [
          "根区土壤分位低于20%，水分压力进入重点关注区间",
          "土壤或降雨信号偏湿，需关注过湿和田间作业风险",
          "土壤或降雨信号偏湿，需关注过湿和田间作业风险"
        ],
        "eased_risks": [
          "no_new_change"
        ],
        "maintained_risks": [
          "轻度异常"
        ],
        "stage_changes": [],
        "official_updates": [],
        "forecast_revisions": []
      },
      "impact_assessment": {
        "current_weather_anomaly": [
          "根区土壤分位低于20%，水分压力进入重点关注区间",
          "土壤或降雨信号偏湿，需关注过湿和田间作业风险",
          "土壤或降雨信号偏湿，需关注过湿和田间作业风险"
        ],
        "formed_impact": [
          "missing"
        ],
        "deterioration_risk": [
          "未来7天累计降雨29.9mm，未来16天累计降雨45.1mm"
        ],
        "repair_potential": [
          "missing"
        ]
      },
      "crop_stage": {
        "current_stage": "FP",
        "status": "available_from_published_snapshot"
      },
      "weather_charts": [],
      "official_metrics": [],
      "institution_forecasts": [],
      "regions": [
        {
          "weather_region_id": "sunflower::Canada::Manitoba::admin1::sunflower_seed",
          "country": "Canada",
          "country_cn": "加拿大",
          "region_name": "Manitoba / Canada",
          "region_name_cn": "Manitoba / Canada",
          "admin_level": "admin1",
          "production_tonnes": 66550.0,
          "national_share": 0.8312204139240348,
          "risk_level_v3": 0,
          "risk_level_v3_code": "normal",
          "risk_level_v3_cn": "正常监控",
          "risk_reason_cn": "降雨、温度和土壤信号未显示明确压力",
          "current_growth_stage_cn": null,
          "resolved_growth_stage": "FP",
          "production_impact_cn": "",
          "forecast_summary_cn": "未来7天累计降雨29.9mm，未来16天累计降雨45.1mm",
          "weather_snapshot_date": "2026-07-20",
          "precip_30d_actual": 100.7,
          "precip_30d_anomaly_mm": 24.24000000000001,
          "temp_max_anomaly_c": -1.22,
          "rootzone_percentile": 66.7,
          "forecast_7d_precip": 29.9,
          "forecast_16d_precip": 45.1,
          "source_name": "statcan",
          "source_year": 2025,
          "aggregation_confidence": "medium",
          "progress_evidence_cn": null
        },
        {
          "weather_region_id": "sunflower::Canada::Ontario::admin1::sunflower_seed",
          "country": "Canada",
          "country_cn": "加拿大",
          "region_name": "Ontario / Canada",
          "region_name_cn": "Ontario / Canada",
          "admin_level": "admin1",
          "production_tonnes": 5313.0,
          "national_share": 0.0663602413099684,
          "risk_level_v3": 3,
          "risk_level_v3_code": "pressure",
          "risk_level_v3_cn": "重点压力",
          "risk_reason_cn": "根区土壤分位低于20%，水分压力进入重点关注区间",
          "current_growth_stage_cn": null,
          "resolved_growth_stage": "OS",
          "production_impact_cn": "",
          "forecast_summary_cn": "未来7天累计降雨19.3mm，未来16天累计降雨27.5mm",
          "weather_snapshot_date": "2026-07-20",
          "precip_30d_actual": 66.7,
          "precip_30d_anomaly_mm": -33.56999999999999,
          "temp_max_anomaly_c": -0.58,
          "rootzone_percentile": 12.0,
          "forecast_7d_precip": 19.3,
          "forecast_16d_precip": 27.5,
          "source_name": "statcan",
          "source_year": 2024,
          "aggregation_confidence": "medium",
          "progress_evidence_cn": null
        },
        {
          "weather_region_id": "sunflower::Canada::Saskatchewan::admin1::sunflower_seed",
          "country": "Canada",
          "country_cn": "加拿大",
          "region_name": "Saskatchewan / Canada",
          "region_name_cn": "Saskatchewan / Canada",
          "admin_level": "admin1",
          "production_tonnes": 4200.0,
          "national_share": 0.052458688782583716,
          "risk_level_v3": 3,
          "risk_level_v3_code": "pressure",
          "risk_level_v3_cn": "重点压力",
          "risk_reason_cn": "土壤或降雨信号偏湿，需关注过湿和田间作业风险",
          "current_growth_stage_cn": null,
          "resolved_growth_stage": "FP",
          "production_impact_cn": "",
          "forecast_summary_cn": "未来7天累计降雨8.4mm，未来16天累计降雨19.9mm",
          "weather_snapshot_date": "2026-07-20",
          "precip_30d_actual": 167.5,
          "precip_30d_anomaly_mm": 96.45,
          "temp_max_anomaly_c": -1.26,
          "rootzone_percentile": 96.8,
          "forecast_7d_precip": 8.4,
          "forecast_16d_precip": 19.9,
          "source_name": "statcan",
          "source_year": 2020,
          "aggregation_confidence": "medium",
          "progress_evidence_cn": null
        },
        {
          "weather_region_id": "sunflower::Canada::Alberta::admin1::sunflower_seed",
          "country": "Canada",
          "country_cn": "加拿大",
          "region_name": "Alberta / Canada",
          "region_name_cn": "Alberta / Canada",
          "admin_level": "admin1",
          "production_tonnes": 4000.0,
          "national_share": 0.04996065598341306,
          "risk_level_v3": 3,
          "risk_level_v3_code": "pressure",
          "risk_level_v3_cn": "重点压力",
          "risk_reason_cn": "土壤或降雨信号偏湿，需关注过湿和田间作业风险",
          "current_growth_stage_cn": null,
          "resolved_growth_stage": "FP",
          "production_impact_cn": "",
          "forecast_summary_cn": "未来7天累计降雨27.4mm，未来16天累计降雨65.1mm，过湿或田间作业压力可能延续",
          "weather_snapshot_date": "2026-07-20",
          "precip_30d_actual": 192.5,
          "precip_30d_anomaly_mm": 97.78,
          "temp_max_anomaly_c": -6.53,
          "rootzone_percentile": 82.6,
          "forecast_7d_precip": 27.4,
          "forecast_16d_precip": 65.1,
          "source_name": "statcan",
          "source_year": 2019,
          "aggregation_confidence": "medium",
          "progress_evidence_cn": null
        }
      ],
      "map_targets": [
        {
          "country": "Canada",
          "region": "Manitoba / Canada",
          "weather_region_id": "sunflower::Canada::Manitoba::admin1::sunflower_seed"
        },
        {
          "country": "Canada",
          "region": "Ontario / Canada",
          "weather_region_id": "sunflower::Canada::Ontario::admin1::sunflower_seed"
        },
        {
          "country": "Canada",
          "region": "Saskatchewan / Canada",
          "weather_region_id": "sunflower::Canada::Saskatchewan::admin1::sunflower_seed"
        },
        {
          "country": "Canada",
          "region": "Alberta / Canada",
          "weather_region_id": "sunflower::Canada::Alberta::admin1::sunflower_seed"
        }
      ],
      "sources": [
        {
          "source": "published_weather_risk_snapshot",
          "observation_end_date": "2026-07-20",
          "is_official": false,
          "status": "available"
        }
      ],
      "quality_flags": [
        "official_metrics_missing",
        "institution_forecasts_missing",
        "revisions_missing"
      ]
    },
    "Romania": {
      "country_record": {
        "country": "Romania",
        "country_cn": "罗马尼亚",
        "country_iso3": null,
        "crop_group": "sunflower",
        "oil_group": "sunflower_oil",
        "crop_oil_label_cn": "葵籽/葵油",
        "production_basis_cn": "葵花籽产量",
        "production_basis_note_cn": "以葵花籽产量作为葵油天气暴露 proxy，并非成品葵油产量。",
        "total_production_tonnes": 1807930.0,
        "source_name": "eurostat",
        "source_year": 2025,
        "source_year_range": "2025-2025",